54111,Offices of Lawyers ,Program service ,Establishments exempt from federal income tax ,Employer Firms ,727,685,704,21.3,19,17.6
5231Y ,Investment Banking and Securities Dealing and Brokerage7 ,All other operating revenue ,All Establishments ,Employer Firms ,"64,943","67,534","72,763",1.2,1.8,1.6
621493,Freestanding Ambulatory Surgical and Emergency Centers ,Patient out-of-pocket - Payments from patients and their families ,All Establishments ,Employer Firms ,"2,329","1,971","1,846",6.1,5.5,5
5171,Wired Telecommunications Carriers2 ,Premium programming package ,All Establishments ,Employer Firms ,"23,592","23,392","21,246",0.9,0.5,0.5
5172,Wireless Telecommunications Carriers (except Satellite)3 ,Mobile long-distance ,All Establishments ,Employer Firms ,"3,354","3,505","3,761",5.3,4.3,3.4
5112,Software Publishers ,Total operating revenue ,All Establishments ,Employer Firms ,"161,744","156,806","145,425",1.9,1.7,1.6
5417,Scientific Research and Development Services ,Production services for development ,Establishments exempt from federal income tax ,Employer Firms ,28,94,89,16.5,22.8,26.1
6212,Offices of Dentists ,Total operating revenue ,All Establishments ,Employer Firms ,"106,042","103,803","101,619",2.2,1.7,1
5152,Cable and Other Subscription Programming ,Air time (advertising and program content) ,All Establishments ,Employer Firms ,"23,304","23,586","21,269",0.5,0.5,0.5
483,Water Transportation ,Other transportation of passengers by water ,All Establishments ,Employer Firms ,77,73,77,22.5,21.6,12.2
51219,Postproduction Services and Other Motion Picture and Video Industries ,Total operating revenue ,All Establishments ,Employer Firms ,"5,415","5,590","5,310",3.8,3.9,3.8
2213,"Water, Sewage and Other Systems ",Total operating revenue ,All Establishments ,Employer Firms ,"12,454","12,195","11,648",1.7,1.5,1.4
56151,Travel Agencies ,All other operating revenue ,All Establishments ,Employer Firms ,"2,324","2,373","2,221",8.7,8.7,7.2
6232,"Residential Intellectual and Developmental Disability, Mental Health and Substance Abuse Facilities11 ",Total operating revenue ,All Establishments ,Employer Firms ,"33,702","32,657","31,948",2,1.8,1.5
6211,Offices of Physicians ,Other patient care revenue ,All Establishments ,Employer Firms ,"55,102","51,366","52,450",4.7,5,3.4
6211,Offices of Physicians ,Patient out-of-pocket - Patients' assigned Social Security benefits ,All Establishments ,Employer Firms ,"1,862","1,497","1,485",17.2,17.2,20.9
5622,Waste Treatment and Disposal ,Hazardous waste treatment and disposal services ,All Establishments ,Employer Firms ,"5,723","6,032","5,607",5.3,4.6,4.4
483,Water Transportation ,Other transportation of passengers by water ,All Establishments ,Employer Firms ,77,73,77,22.5,21.6,12.2
5172,Wireless Telecommunications Carriers (except Satellite)3 ,Telecommunication network installation services ,All Establishments ,Employer Firms ,160,S,S,7.9,S,S
54182,Public Relations Agencies ,All other operating revenue ,All Establishments ,Employer Firms ,775,709,602,12.7,9.9,13.1
5415,Computer Systems Design and Related Services ,Rental and leasing of computer hardware ,All Establishments ,Employer Firms ,S,S,S,S,S,S
62132,Offices of Optometrists ,"Private insurance (includes Health, Property, and Auto) ",All Establishments ,Employer Firms ,"4,447","4,310","4,161",3.2,2.3,1.8
62131,Offices of Chiropractors ,Investment and property income ,All Establishments ,Employer Firms ,S,24,27,S,15.7,26.7
5121x ,Motion Picture and Video Production and Distribution1 ,Merchandise licensing ,All Establishments ,Employer Firms ,837,769,546,5.5,3.5,3.7
621391,Offices of Podiatrists ,Patient out-of-pocket - Patients' assigned Social Security benefits ,All Establishments ,Employer Firms ,40,39,38,18.5,25.5,25.4
62133,"Offices of Mental Health Practitioners, (except Physicians) ",Total operating revenue ,All Establishments ,Employer Firms ,"8,040","7,350","6,702",4.5,4.3,4.4
5171,Wired Telecommunications Carriers2 ,Fixed services - Fixed local telephony ,All Establishments ,Employer Firms ,"39,272","41,973","45,650",0.9,0.8,0.7
561599,All Other Travel Arrangement and Reservation Services ,Commissions or fees from computerized reservation systems ,All Establishments ,Employer Firms ,"1,713","1,668","1,629",5,4.1,4.5
62141,Outpatient Care Centers ,Total operating revenue ,All Establishments ,Employer Firms ,"2,002","1,914","1,864",3.3,3.1,2.8
5152,Cable and Other Subscription Programming ,Total operating revenue ,All Establishments ,Employer Firms ,"64,168","60,318","55,168",0.4,0.3,0.2
5171,Wired Telecommunications Carriers2 ,Fixed services - Fixed local telephony ,All Establishments ,Employer Firms ,"39,272","41,973","45,650",0.9,0.8,0.7
62131,Offices of Chiropractors ,Investment and property income ,All Establishments ,Employer Firms ,S,24,27,S,15.7,26.7
56152,Tour Operators ,Customized group tours - Domestic travel ,All Establishments ,Employer Firms ,"1,106","1,000",851,12.4,11.7,8.1
51224,Sound Recording Studios ,All other operating revenue ,All Establishments ,Employer Firms ,230,205,184,11.5,10.4,8.8
712,"Museums, Historical Sites, and Similar Institutions ",Program service ,Establishments exempt from federal income tax ,Employer Firms ,"3,670","3,497","3,323",3.8,2.7,3.1
54186,Direct Mail Advertising ,Mail list creation and support services ,All Establishments ,Employer Firms ,446,410,414,20.2,15.5,15.4
62132,Offices of Optometrists ,"Government (includes Medicare, Medicaid, Other Government, and Workers Compensation) ",All Establishments ,Employer Firms ,"1,768","1,631","1,587",3.3,3.9,3.8
5239X ,Portfolio Management and Investment Advice9 ,Financial planning and investment management services for businesses and governments ,All Establishments ,Employer Firms ,"90,679","86,267","76,236",4.1,4.2,4
54161,Management Consulting Services10 ,"Financial management consulting, and consulting combined with implementation ",All Establishments ,Employer Firms ,"7,818","7,647","7,835",9.8,7.4,7.3
621493,Freestanding Ambulatory Surgical and Emergency Centers ,All other non-patient care revenue ,All Establishments ,Employer Firms ,664,S,S,10.5,S,S
54133,Engineering Services ,Other engineering projects ,All Establishments ,Employer Firms ,"19,848","19,489","19,266",26.7,28.1,23.6
6233,Community Care Facilities for the Elderly ,"Contributions, gifts, and grants received ",All Establishments ,Employer Firms ,553,512,503,11.1,9.9,9.8
5231Y ,Investment Banking and Securities Dealing and Brokerage7 ,Trading debt instruments on own account - Net gains (losses) ,All Establishments ,Employer Firms ,"4,488","2,704","3,373",5.2,8.1,4.6
5112,Software Publishers ,System software publishing - Development tools and programming languages software ,All Establishments ,Employer Firms ,"3,524","3,127","3,170",19.1,8.3,9.8
5622,Waste Treatment and Disposal ,Nonhazardous waste disposal services ,All Establishments ,Employer Firms ,"7,565","6,847","6,623",4.5,2.5,2.4
621492,Kidney Dialysis Centers ,All other non-patient care revenue ,All Establishments ,Employer Firms ,81,68,71,19.3,9.8,22.2
S ,"Estimate does not meet publication standards because of high sampling variability (coefficient of variation is greater than 30%) or poor response quality (total quantity response rate is less than 50%) or other concerns about the estimate's quality.  Unpublished estimates derived from this table by subtraction are subject to these same limitations and should not be attributed to the U.S. Census Bureau.  For a description of publication standards and the total quantity response rate, see http://www.census.gov/quality/standards/standardf1.html. ",,,,,,,,,
621399,Offices of All Other Miscellaneous Health Practitioners ,Patient out-of-pocket - Patients' assigned Social Security benefits ,All Establishments ,Employer Firms ,S,S,S,S,S,S
486,Pipeline Transportation ,Transportation of bulk natural gas and liquefied natural gas by pipeline ,All Establishments ,Employer Firms ,"21,867","22,242","20,839",Z,Z,Z
51213,Motion Picture and Video Exhibition ,Admissions to feature film exhibitions ,All Establishments ,Employer Firms ,"9,521","8,859","9,101",3.4,2.6,2.1
621399,Offices of All Other Miscellaneous Health Practitioners ,"Government (includes Medicare, Medicaid, Other Government, and Workers Compensation) ",All Establishments ,Employer Firms ,"1,161","1,202","1,145",6.2,5,5.4
621391,Offices of Podiatrists ,Total operating revenue ,All Establishments ,Employer Firms ,"4,646","4,301","4,149",4.1,3.6,3.1
62133,"Offices of Mental Health Practitioners, (except Physicians) ","Private insurance (includes Health, Property, and Auto) ",All Establishments ,Employer Firms ,"1,867","1,678","1,572",5.8,4.8,4.7
51213,Motion Picture and Video Exhibition ,Rental of retail space (concessionaire space in movie theaters) ,All Establishments ,Employer Firms ,70,62,61,10.5,8.9,9.8
62131,Offices of Chiropractors ,Patient out-of-pocket - Patients' assigned Social Security benefits ,All Establishments ,Employer Firms ,143,152,147,16.6,14.9,14.7
5171,Wired Telecommunications Carriers2 ,Total operating revenue ,All Establishments ,Employer Firms ,"311,451","301,727","293,929",0.7,0.6,0.5
5415,Computer Systems Design and Related Services ,Network design and development ,All Establishments ,Employer Firms ,"7,298",S,"5,853",19.4,S,15.1
8,Includes NAICS 52313 (Commodity Contracts Dealing) and NAICS 52314 (Commodity Contracts Brokerage). ,,,,,,,,,
5121x ,Motion Picture and Video Production and Distribution1 ,All other operating revenue ,All Establishments ,Employer Firms ,"4,110","3,876","3,859",5,4.3,3.4
62141,Outpatient Care Centers ,"Government (includes Medicare, Medicaid, Other Government, and Workers Compensation) ",All Establishments ,Employer Firms ,513,516,503,6.9,6.2,5.6
485,Transit and Ground Passenger Transportation ,"Long-distance, passenger transportation by road except fixed route ",All Establishments ,Employer Firms ,"1,997","1,884","1,846",8.9,10,8.7
5231X ,Commodity Contracts Dealing and Brokerage8 ,Total operating revenue ,All Establishments ,Employer Firms ,"13,432","13,626","14,145",3.6,3.4,3.8
51112,Periodical Publishers ,Sale or licensing of rights to content ,All Establishments ,Employer Firms ,506,482,475,13.4,15.2,15.3
62141,Outpatient Care Centers ,Patient out-of-pocket - Payments from patients and their families ,All Establishments ,Employer Firms ,602,567,542,4.4,5,4.4
2212,Natural Gas Distribution ,Sales of energy and resources - Other revenue from sales of energy ,All Establishments ,Employer Firms ,"8,384","11,019","11,134",4.2,5.4,6.3
6219,Other Ambulatory Health Care Services ,"Government (includes Medicare, Medicaid, Other Government, and Workers Compensation) ",All Establishments ,Employer Firms ,"7,626","7,072","6,721",4.7,4.1,3.4
5152,Cable and Other Subscription Programming ,Advertising and program revenue - Licensing of rights to broadcast specialty programming protected by copyright ,All Establishments ,Employer Firms ,"36,764","33,821","31,354",0.7,0.7,0.7
6231,Nursing Care Facilities (Skilled Nursing Facilities)11 ,Other patient care revenue ,All Establishments ,Employer Firms ,"2,401","2,435","2,437",4.8,3.3,3.7
711212,Racetracks ,Admissions revenue (excluding admissions taxes) ,Establishments subject to federal income tax ,Employer Firms ,737,722,775,9.7,8.7,8.2
51114,Directory and Mailing List Publishers ,Rental or sale of mailing lists ,All Establishments ,Employer Firms ,S,118,127,S,29.4,26.4
5171,Wired Telecommunications Carriers2 ,Total operating revenue ,All Establishments ,Employer Firms ,"311,451","301,727","293,929",0.7,0.6,0.5
5121x ,Motion Picture and Video Production and Distribution1 ,All other operating revenue ,All Establishments ,Employer Firms ,"4,110","3,876","3,859",5,4.3,3.4
6115,Technical and Trade Schools ,Total operating revenue ,All Establishments ,Employer Firms ,"15,478","15,822","14,991",3.9,4.2,2.8
5112,Software Publishers ,Application software publishing - General business productivity and home use applications ,All Establishments ,Employer Firms ,"28,039","27,990","25,731",6.6,6.2,4.8
622,Hospitals ,Patient out-of-pocket - Patients' assigned Social Security benefits ,All Establishments ,Employer Firms ,"1,174","1,176",S,21.3,23.7,S
6116,Other Schools and Instruction ,"Occupational, technical, and trade; professional development; and management training programs and courses ",All Establishments ,Employer Firms ,"13,040","12,308","11,428",4.4,4.3,4
62134,"Offices of Physical, Occupational and Speech Therapists and Audiologists ",Other patient care revenue ,All Establishments ,Employer Firms ,"4,621","4,260","4,109",7,5.4,4.8
56151,Travel Agencies ,Commissions or fees from trip planning ,All Establishments ,Employer Firms ,"4,119","4,101","3,821",7.6,8.7,8.9
561599,All Other Travel Arrangement and Reservation Services ,Commissions or fees from trip planning ,All Establishments ,Employer Firms ,"1,586","1,633","1,538",24.9,21.5,20
6117,Educational Support Services ,All other operating revenue ,All Establishments ,Employer Firms ,"2,450","2,741","2,737",8.8,8.4,7.5
5621,Waste Collection ,Hazardous waste management collection services ,All Establishments ,Employer Firms ,"1,205","1,386","1,478",6.3,5,4
54182,Public Relations Agencies ,Full public relations services ,All Establishments ,Employer Firms ,"7,256","6,857","6,643",5.5,5.1,4.3
621498,All Other Outpatient Care Centers ,Total operating revenue ,All Establishments ,Employer Firms ,"34,891","33,416","31,709",1.4,1.2,1.2
6233,Community Care Facilities for the Elderly ,Patient out-of-pocket - Patients' assigned Social Security benefits ,All Establishments ,Employer Firms ,447,429,416,14.3,15.8,14.9
5231X ,Commodity Contracts Dealing and Brokerage8 ,Trading derivative contracts on own account - Net gains (losses) ,All Establishments ,Employer Firms ,"1,666",-579,"2,078",6.5,-11.5,4.9
6231,Nursing Care Facilities (Skilled Nursing Facilities)11 ,"Government (includes Medicare, Medicaid, Other Government, and Workers Compensation) ",All Establishments ,Employer Firms ,"84,291","83,112","78,620",2.4,2.3,2.3
6233,Community Care Facilities for the Elderly ,"Private insurance (includes Health, Property, and Auto) ",All Establishments ,Employer Firms ,"2,059","2,175","1,979",12.1,10.9,10.6
62132,Offices of Optometrists ,Total operating revenue ,All Establishments ,Employer Firms ,"12,579","12,025","11,684",2.2,1.9,1.5
54133,Engineering Services ,"Commercial, public, and institutional engineering projects ",All Establishments ,Employer Firms ,"13,718","12,054","10,611",21.6,21.8,20
6216,Home Health Care Services ,Patient out-of-pocket - Patients' assigned Social Security benefits ,All Establishments ,Employer Firms ,31,24,27,16.4,2.7,2.5
6239,Other Residential Care Facilities ,Patient out-of-pocket - Payments from patients and their families ,All Establishments ,Employer Firms ,239,221,212,14.2,14.6,12.3
5171,Wired Telecommunications Carriers2 ,Website hosting services ,All Establishments ,Employer Firms ,215,292,304,5.8,2.5,3
6219,Other Ambulatory Health Care Services ,Other patient care revenue ,All Establishments ,Employer Firms ,"11,327","11,394","11,063",1.4,1.7,1.7
6114,Business Schools and Computer and Management Training ,Total operating revenue ,All Establishments ,Employer Firms ,"10,106","10,144","9,494",3.5,3.3,3.1
622,Hospitals ,"Contributions, gifts, and grants received ",All Establishments ,Employer Firms ,"16,949","16,254","15,418",16.2,15.5,15.9
561599,All Other Travel Arrangement and Reservation Services ,Commissions or fees from computerized reservation systems ,All Establishments ,Employer Firms ,"1,713","1,668","1,629",5,4.1,4.5
6115,Technical and Trade Schools ,"Occupational, technical, and trade; professional development; and management training programs and courses ",All Establishments ,Employer Firms ,"13,365","13,394","12,801",4.4,4.9,3.7
56299,All Other Waste Management Services ,Total operating revenue ,All Establishments ,Employer Firms ,"4,689","4,126","3,750",5,5.3,5
51222,Integrated Record Production/Distribution ,Licensing revenue - Licensing of rights to use musical recordings ,All Establishments ,Employer Firms ,D,668,791,D,1,0.9
56151,Travel Agencies ,"Commissions or fees from airline seats, domestic destinations ",All Establishments ,Employer Firms ,"1,447","1,429","1,415",7.8,7.9,8.2
522,Credit Intermediation and Related Activities ,Loan income from businesses and governments ,All Establishments ,Employer Firms ,"181,470","183,809","197,028",6,5.5,5.7
621493,Freestanding Ambulatory Surgical and Emergency Centers ,"Contributions, gifts, and grants received ",All Establishments ,Employer Firms ,S,S,S,S,S,S
621491,Other Outpatient Care Centers ,Other patient care revenue ,All Establishments ,Employer Firms ,547,500,450,1.3,1.3,1.3
54161,Management Consulting Services10 ,Actuarial consulting (except for employee pensions and other benefits) ,All Establishments ,Employer Firms ,"1,437","1,308","1,214",11.4,10.4,11.8
6232,"Residential Intellectual and Developmental Disability, Mental Health and Substance Abuse Facilities11 ","Contributions, gifts, and grants received ",All Establishments ,Employer Firms ,"1,040","1,009",984,13.5,11.9,10.7
522,Credit Intermediation and Related Activities ,Credit card income from businesses and governments ,All Establishments ,Employer Firms ,"23,104","21,678","22,354",6.7,6.2,5.4
621492,Kidney Dialysis Centers ,Patient out-of-pocket - Payments from patients and their families ,All Establishments ,Employer Firms ,97,103,101,3.2,3.2,2.3
6212,Offices of Dentists ,"Government (includes Medicare, Medicaid, Other Government, and Workers Compensation) ",All Establishments ,Employer Firms ,"9,957","11,049","10,982",5.8,8.5,6.9
51113,Book Publishers ,Books - adult trade books ,All Establishments ,Employer Firms ,"6,637","7,024","7,075",3.2,3.4,3.2
62142,Outpatient Mental Health and Substance Abuse Centers ,"Contributions, gifts, and grants received ",All Establishments ,Employer Firms ,"1,097","1,229","1,174",13.3,8.9,9.1
621491,Other Outpatient Care Centers ,Investment and property income ,All Establishments ,Employer Firms ,563,529,472,1.3,1.3,1.3
517911,Telecommunications Resellers4 ,Mobile telephony ,All Establishments ,Employer Firms ,"2,045","1,894",S,18.1,16.1,S
51913,Internet Publishing and Broadcasting and Web Search Portals6 ,All other operating revenue ,All Establishments ,Employer Firms ,"6,880","5,261","4,037",5.5,5.7,4.5
711219,Other Spectator Sports ,All other operating revenue ,Establishments subject to federal income tax ,Employer Firms ,"3,235","3,339","3,194",12,12.1,9.6
6231,Nursing Care Facilities (Skilled Nursing Facilities)11 ,All other non-patient care revenue ,All Establishments ,Employer Firms ,"2,486","2,302","2,249",5.3,4.4,3.9
5417,Scientific Research and Development Services ,Production services for development ,Establishments subject to federal income tax ,Employer Firms ,"3,556","2,869","2,470",14.6,27.5,15.4
54182,Public Relations Agencies ,Media relations ,All Establishments ,Employer Firms ,828,747,764,11.5,15.2,14.7
5112,Software Publishers ,System software publishing - Development tools and programming languages software ,All Establishments ,Employer Firms ,"3,524","3,127","3,170",19.1,8.3,9.8
5415,Computer Systems Design and Related Services ,Network design and development ,All Establishments ,Employer Firms ,"7,298",S,"5,853",19.4,S,15.1
621492,Kidney Dialysis Centers ,Other patient care revenue ,All Establishments ,Employer Firms ,594,528,502,3.5,3.3,2.9
5417,Scientific Research and Development Services ,Licensing of right to use intellectual property ,Establishments subject to federal income tax ,Employer Firms ,"13,983","15,146","10,720",10.5,18.2,7.3
5112,Software Publishers ,Application software publishing - Vertical market application software ,All Establishments ,Employer Firms ,"8,231","8,782","8,263",17.1,11.6,11
6231,Nursing Care Facilities (Skilled Nursing Facilities)11 ,Patient out-of-pocket - Patients' assigned Social Security benefits ,All Establishments ,Employer Firms ,"1,474","1,295","1,262",5.2,6.3,6.3
6219,Other Ambulatory Health Care Services ,Patient out-of-pocket - Patients' assigned Social Security benefits ,All Establishments ,Employer Firms ,22,19,17,10,9.6,7.5
54181,Advertising Agencies ,Integrated advertising services ,All Establishments ,Employer Firms ,"20,284","17,897","16,747",6.1,8,7.4
6215,Medical and Diagnostic Laboratories ,Total operating revenue ,All Establishments ,Employer Firms ,"46,542","47,151","45,318",2.3,2.2,1.8
51219,Postproduction Services and Other Motion Picture and Video Industries ,Audiovisual postproduction services ,All Establishments ,Employer Firms ,"3,456","3,478","3,167",3.9,4.4,4
5417,Scientific Research and Development Services ,All other non-operating revenue ,Establishments exempt from federal income tax ,Employer Firms ,647,416,735,10,14.3,7.9
5417,Scientific Research and Development Services ,Total operating revenue ,Establishments subject to federal income tax ,Employer Firms ,"98,693","93,174","86,086",5.7,5.3,4.8
54133,Engineering Services ,Construction services ,All Establishments ,Employer Firms ,"20,316","17,669","17,102",22.5,16.1,15.4
5417,Scientific Research and Development Services ,"Basic and applied research in natural and exact sciences, except biological sciences ",Establishments subject to federal income tax ,Employer Firms ,"9,264","9,102","9,248",7.1,5.7,6.4
6216,Home Health Care Services ,Investment and property income ,All Establishments ,Employer Firms ,156,121,132,8.4,7.1,6.9
484,Truck Transportation ,Motor carrier revenue ,All Establishments ,Employer Firms ,"212,446","198,945","178,938",1.5,1.5,1.5
51111,Newspaper Publishers ,Printing services for others ,All Establishments ,Employer Firms ,"1,448","1,313","1,258",6,6.9,7.1
6215,Medical and Diagnostic Laboratories ,Outpatient care facilities ,All Establishments ,Employer Firms ,"1,245","1,262","1,310",12.5,10.1,10
56152,Tour Operators ,Total operating revenue ,All Establishments ,Employer Firms ,"5,665","5,382","5,283",4.5,4.7,4.9
6211,Offices of Physicians ,Investment and property income ,All Establishments ,Employer Firms ,842,912,"1,085",13.5,11.5,18.8
5152,Cable and Other Subscription Programming ,Air time (advertising and program content) ,All Establishments ,Employer Firms ,"23,304","23,586","21,269",0.5,0.5,0.5
54131,Architectural Services ,Multi-family residential projects ,All Establishments ,Employer Firms ,"1,680","1,569","1,232",21.4,19.7,18.5
51224,Sound Recording Studios ,Studio recording ,All Establishments ,Employer Firms ,614,613,605,5.7,6,5.8
51222,Integrated Record Production/Distribution ,Sale of recordings ,All Establishments ,Employer Firms ,"4,597","4,579","5,558",1,1.2,0.7
5231Y ,Investment Banking and Securities Dealing and Brokerage7 ,Brokering and dealing products - Derivative contracts ,All Establishments ,Employer Firms ,"20,658","20,161","27,062",2.8,2.6,2.3
6232,"Residential Intellectual and Developmental Disability, Mental Health and Substance Abuse Facilities11 ","Private insurance (includes Health, Property, and Auto) ",All Establishments ,Employer Firms ,"2,038","1,880","1,783",9,9.2,8.8
5171,Wired Telecommunications Carriers2 ,Air time (advertising and program content) ,All Establishments ,Employer Firms ,S,"5,146","5,051",S,0.6,0.5
6115,Technical and Trade Schools ,"Occupational, technical, and trade; professional development; and management training programs and courses ",All Establishments ,Employer Firms ,"13,365","13,394","12,801",4.4,4.9,3.7
6212,Offices of Dentists ,Total operating revenue ,All Establishments ,Employer Firms ,"106,042","103,803","101,619",2.2,1.7,1
485,Transit and Ground Passenger Transportation ,Total operating revenue ,All Establishments ,Employer Firms ,"29,971","28,256","27,020",2.3,2,1.5
2211,"Electric Power Generation, Transmission and Distribution ",All other operating revenue ,All Establishments ,Employer Firms ,"8,062","8,612","6,646",7.9,7.3,6.4
51512,Television Broadcasting ,All other operating revenue ,All Establishments ,Employer Firms ,"5,463","6,025","5,692",1,1.7,1.1
6231,Nursing Care Facilities (Skilled Nursing Facilities)11 ,Patient out-of-pocket - Payments from patients and their families ,All Establishments ,Employer Firms ,"11,659","11,298","11,247",2.8,2.7,2.2
51919,All Other Information Services ,Information services ,All Establishments ,Employer Firms ,350,281,272,9.7,9.6,7.7
621493,Freestanding Ambulatory Surgical and Emergency Centers ,"Contributions, gifts, and grants received ",All Establishments ,Employer Firms ,S,S,S,S,S,S
62142,Outpatient Mental Health and Substance Abuse Centers ,"Private insurance (includes Health, Property, and Auto) ",All Establishments ,Employer Firms ,"2,043","1,869","1,783",6.1,7.6,9.7
56132,Temporary Help Services ,Long-term staffing ,All Establishments ,Employer Firms ,"10,497","10,894","9,627",11.9,9.3,8.4
5417,Scientific Research and Development Services ,Total operating revenue ,Establishments subject to federal income tax ,Employer Firms ,"98,693","93,174","86,086",5.7,5.3,4.8
51112,Periodical Publishers ,All other operating revenue ,All Establishments ,Employer Firms ,"7,147","7,466","7,703",6.4,4.6,4.5
5172,Wireless Telecommunications Carriers (except Satellite)3 ,Repair and maintenance services for telecommunications equipment ,All Establishments ,Employer Firms ,S,"1,480","1,335",S,4.9,5.4
5412,"Accounting, Tax Preparation, Bookkeeping, and Payroll Services ",Taxation preparation and representation services for individuals and unincorporated businesses ,All Establishments ,Employer Firms ,"15,482","14,933","14,940",5.9,6,5.4
