5172,Wireless Telecommunications Carriers (except Satellite)3 ,Rental of telecommunications equipment ,All Establishments ,Employer Firms ,345,362,336,14.3,15.8,16.1
6211,Offices of Physicians ,Patient out-of-pocket - Patients' assigned Social Security benefits ,All Establishments ,Employer Firms ,"1,862","1,497","1,485",17.2,17.2,20.9
6212,Offices of Dentists ,Total operating revenue ,All Establishments ,Employer Firms ,"106,042","103,803","101,619",2.2,1.7,1
5112,Software Publishers ,Application software publishing - Cross-industry application software ,All Establishments ,Employer Firms ,"13,186","12,186","10,785",5,4.7,5.1
10,"A portion of NAICS 54161 (Management Consulting Services) moved to NAICS 56131 (Employment Placement Agencies and Executive Search Services) with the 2007 NAICS update. Historical data, 2010 and prior, have been restated to reflect comparable data on the 2007 NAICS basis. ",,,,,,,,,
6231,Nursing Care Facilities (Skilled Nursing Facilities)11 ,Other patient care revenue ,All Establishments ,Employer Firms ,"2,401","2,435","2,437",4.8,3.3,3.7
56292,Material Recovery Facilities ,Total operating revenue ,All Establishments ,Employer Firms ,"5,068","5,842","4,854",5.3,5.1,5
6232,"Residential Intellectual and Developmental Disability, Mental Health and Substance Abuse Facilities11 ",Patient out-of-pocket - Payments from patients and their families ,All Establishments ,Employer Firms ,"1,983","1,833","1,735",8.4,8.7,8.3
622,Hospitals ,All other non-patient care revenue ,All Establishments ,Employer Firms ,"35,887","31,513","29,165",4.8,5.1,4.3
5239X ,Portfolio Management and Investment Advice9 ,All other operating revenue ,All Establishments ,Employer Firms ,"37,869","39,900","42,904",6.2,6.4,4.9
5417,Scientific Research and Development Services ,All other non-operating revenue ,Establishments exempt from federal income tax ,Employer Firms ,647,416,735,10,14.3,7.9
6211,Offices of Physicians ,All other non-patient care revenue ,All Establishments ,Employer Firms ,"19,595","15,992","14,800",6,6.7,5.5
2211,"Electric Power Generation, Transmission and Distribution ",Sewer system user charges ,All Establishments ,Employer Firms ,20,19,32,Z,3.6,0.2
5239X ,Portfolio Management and Investment Advice9 ,Financial planning and investment management services for businesses and governments ,All Establishments ,Employer Firms ,"90,679","86,267","76,236",4.1,4.2,4
51114,Directory and Mailing List Publishers ,"Directories, databases, and other collections of information - Advertising space ",All Establishments ,Employer Firms ,"9,323","10,064","10,401",2.5,2.3,2.3
517911,Telecommunications Resellers4 ,Total operating revenue ,All Establishments ,Employer Firms ,"9,945","9,683","9,817",6.7,5.6,4.4
621491,Other Outpatient Care Centers ,"Private insurance (includes Health, Property, and Auto) ",All Establishments ,Employer Firms ,"4,486","4,225","3,799",1.2,1.3,1.3
621391,Offices of Podiatrists ,"Contributions, gifts, and grants received ",All Establishments ,Employer Firms ,S,S,4,S,S,23.6
561599,All Other Travel Arrangement and Reservation Services ,All other operating revenue ,All Establishments ,Employer Firms ,S,"1,515","1,433",S,5.5,5.2
5231Y ,Investment Banking and Securities Dealing and Brokerage7 ,Trading equities on own account - Net gains (losses) ,All Establishments ,Employer Firms ,"3,954","3,757","1,818",5,5.1,6.2
51219,Postproduction Services and Other Motion Picture and Video Industries ,Motion picture film laboratory services ,All Establishments ,Employer Firms ,S,320,419,S,3.6,2.4
51224,Sound Recording Studios ,Studio recording ,All Establishments ,Employer Firms ,614,613,605,5.7,6,5.8
621498,All Other Outpatient Care Centers ,Patient out-of-pocket - Payments from patients and their families ,All Establishments ,Employer Firms ,"1,546","1,465","1,400",4.6,4.1,3.6
5239X ,Portfolio Management and Investment Advice9 ,Trust products ,All Establishments ,Employer Firms ,"6,083","5,424","5,377",6.2,5.9,8
561599,All Other Travel Arrangement and Reservation Services ,"Commissions or fees from airline seats, international destinations ",All Establishments ,Employer Firms ,S,13,S,S,4.3,S
5231Y ,Investment Banking and Securities Dealing and Brokerage7 ,Brokering and dealing products - Derivative contracts ,All Establishments ,Employer Firms ,"20,658","20,161","27,062",2.8,2.6,2.3
6216,Home Health Care Services ,Other patient care revenue ,All Establishments ,Employer Firms ,"2,511","2,379","2,304",18.8,11.7,10.8
5231Y ,Investment Banking and Securities Dealing and Brokerage7 ,Trading derivative contracts on own account - Net gains (losses) ,All Establishments ,Employer Firms ,"8,753","9,432","9,357",10.2,10.6,5.4
62141,Outpatient Care Centers ,"Contributions, gifts, and grants received ",All Establishments ,Employer Firms ,424,380,370,8.3,8.2,7.8
  ,  ,,,,,,,,,
6239,Other Residential Care Facilities ,"Government (includes Medicare, Medicaid, Other Government, and Workers Compensation) ",All Establishments ,Employer Firms ,"5,744","5,580","5,501",3.6,2.8,2.8
5622,Waste Treatment and Disposal ,Hazardous waste treatment and disposal services ,All Establishments ,Employer Firms ,"5,723","6,032","5,607",5.3,4.6,4.4
6239,Other Residential Care Facilities ,"Contributions, gifts, and grants received ",All Establishments ,Employer Firms ,"1,333","1,326","1,320",5.4,4.2,4.7
51223,Music Publishers ,Sale of recordings ,All Establishments ,Employer Firms ,143,153,123,6.4,4.9,4.7
54131,Architectural Services ,Single-family residential projects ,All Establishments ,Employer Firms ,"2,314","2,274","2,180",18.4,18.5,16.2
522,Credit Intermediation and Related Activities ,All other operating revenue ,All Establishments ,Employer Firms ,"222,691","211,842","220,932",3.3,2.8,3
517911,Telecommunications Resellers4 ,Mobile telephony ,All Establishments ,Employer Firms ,"2,045","1,894",S,18.1,16.1,S
5171,Wired Telecommunications Carriers2 ,Total operating revenue ,All Establishments ,Employer Firms ,"311,451","301,727","293,929",0.7,0.6,0.5
54111,Offices of Lawyers ,All other non-operating revenue ,Establishments exempt from federal income tax ,Employer Firms ,105,74,69,22.5,13.9,15.7
62142,Outpatient Mental Health and Substance Abuse Centers ,Investment and property income ,All Establishments ,Employer Firms ,57,61,53,29.5,25.2,11.9
5171,Wired Telecommunications Carriers2 ,Subscriber line charges ,All Establishments ,Employer Firms ,"4,347","4,347","3,430",1,1.2,1.6
56151,Travel Agencies ,Commissions or fees from lodging ,All Establishments ,Employer Firms ,"3,035","2,976","2,671",7,7.2,6.9
5121x ,Motion Picture and Video Production and Distribution1 ,Audiovisual works speculatively produced for outright sale ,All Establishments ,Employer Firms ,377,341,321,9.7,5.2,7.1
484,Truck Transportation ,Total operating revenue ,All Establishments ,Employer Firms ,"230,632","215,884","194,616",1.4,1.5,1.4
621391,Offices of Podiatrists ,Investment and property income ,All Establishments ,Employer Firms ,S,33,27,S,16.4,19.1
5412,"Accounting, Tax Preparation, Bookkeeping, and Payroll Services ","Bookkeeping, compilation, billing, and collection services ",All Establishments ,Employer Firms ,"6,623","5,757","5,739",9.5,12.1,10.7
511191,Greeting Card Publishers ,All other operating revenue ,All Establishments ,Employer Firms ,"1,143","1,225","1,247",2.2,1.6,2.5
5231Y ,Investment Banking and Securities Dealing and Brokerage7 ,All other operating revenue ,All Establishments ,Employer Firms ,"64,943","67,534","72,763",1.2,1.8,1.6
5239X ,Portfolio Management and Investment Advice9 ,All other operating revenue ,All Establishments ,Employer Firms ,"37,869","39,900","42,904",6.2,6.4,4.9
621399,Offices of All Other Miscellaneous Health Practitioners ,Total operating revenue ,All Establishments ,Employer Firms ,"5,064","4,779","4,463",4.5,4,4.6
51112,Periodical Publishers ,Printing services for others ,All Establishments ,Employer Firms ,"1,357","1,511","1,533",19.9,16.1,15.1
6232,"Residential Intellectual and Developmental Disability, Mental Health and Substance Abuse Facilities11 ","Contributions, gifts, and grants received ",All Establishments ,Employer Firms ,"1,040","1,009",984,13.5,11.9,10.7
6219,Other Ambulatory Health Care Services ,Other patient care revenue ,All Establishments ,Employer Firms ,"11,327","11,394","11,063",1.4,1.7,1.7
5,"Historical data, 2010 and prior, have been restated to reflect comparable data on the 2007 NAICS basis for more detailed levels within this aggregate. ",,,,,,,,,
6115,Technical and Trade Schools ,All other operating revenue ,All Establishments ,Employer Firms ,"2,113","2,428","2,190",9.7,11,11.4
6232,"Residential Intellectual and Developmental Disability, Mental Health and Substance Abuse Facilities11 ",All other non-patient care revenue ,All Establishments ,Employer Firms ,716,649,664,7,10,10.1
5171,Wired Telecommunications Carriers2 ,Carrier services ,All Establishments ,Employer Firms ,"18,722","19,534","18,967",1.8,2.1,2.6
621399,Offices of All Other Miscellaneous Health Practitioners ,Investment and property income ,All Establishments ,Employer Firms ,S,S,6,S,S,25.1
5412,"Accounting, Tax Preparation, Bookkeeping, and Payroll Services ",Assurance and related services ,All Establishments ,Employer Firms ,"29,076","27,602","27,116",3.7,3.2,3.5
56152,Tour Operators ,Pre-packaged tours - Domestic travel ,All Establishments ,Employer Firms ,"1,214","1,209","1,234",8.2,9.2,8.7
5171,Wired Telecommunications Carriers2 ,Premium programming package ,All Establishments ,Employer Firms ,"23,592","23,392","21,246",0.9,0.5,0.5
561599,All Other Travel Arrangement and Reservation Services ,"Commissions or fees from airline seats, domestic destinations ",All Establishments ,Employer Firms ,185,198,249,4.7,4.8,4.9
484,Truck Transportation ,Motor carrier revenue ,All Establishments ,Employer Firms ,"212,446","198,945","178,938",1.5,1.5,1.5
6215,Medical and Diagnostic Laboratories ,Health Practitioners ,All Establishments ,Employer Firms ,"4,177","4,243","4,019",5.4,4.9,5
3,"Includes 2002 NAICS 517211 (Paging), 2002 NAICS 517212 (Cellular and Other Wireless Telecommunications) and a portion of 2002 NAICS 518111 (Internet Service Providers).  Historical data, 2010 and prior, have been restated to reflect comparable data on the 2007 NAICS basis. ",,,,,,,,,
481,Air Transportation ,"Domestic, scheduled freight transportation by air ",All Establishments ,Employer Firms ,"2,730","2,884","2,238",2.4,2.1,2.8
2212,Natural Gas Distribution ,Sales of energy and resources - Water ,All Establishments ,Employer Firms ,D,ZZ,ZZ,D,NA,NA
5121x ,Motion Picture and Video Production and Distribution1 ,Other production services ,All Establishments ,Employer Firms ,"3,584","3,093","2,900",6.9,7.7,5.1
5112,Software Publishers ,System software publishing - Database management software ,All Establishments ,Employer Firms ,"10,492","10,267","9,913",4.1,7,7.8
6116,Other Schools and Instruction ,All other operating revenue ,All Establishments ,Employer Firms ,"6,804","5,871","5,503",5,4.5,4.4
5121x ,Motion Picture and Video Production and Distribution1 ,Domestic licensing of rights to motion picture films ,All Establishments ,Employer Firms ,"13,729","13,507","13,785",2,1.9,2
